{
 "about": {},
 "conda_build_config": {},
 "files": [
  "Lib/site-packages/wera2netcdf-0.0.4-py3.5.egg-info/PKG-INFO",
  "Lib/site-packages/wera2netcdf/__init__.py",
  "Lib/site-packages/wera2netcdf/tests/__init__.py",
  "Lib/site-packages/wera2netcdf/tests/test_convert.py",
  "Lib/site-packages/wera2netcdf/wera.py"
 ],
 "index": {
  "arch": "x86_64",
  "build": "py35_0",
  "build_number": 0,
  "depends": [
   "netcdf4",
   "pandas",
   "pygc",
   "python 3.5*",
   "python-dateutil",
   "pytz"
  ],
  "license": "MIT License",
  "name": "wera2netcdf",
  "platform": "win",
  "subdir": "win-64",
  "version": "0.0.4"
 },
 "metadata_version": 1,
 "name": "wera2netcdf",
 "raw_recipe": "package:\n    name: wera2netcdf\n    version: 0.0.4\n\nsource:\n    fn: wera2netcdf-0.0.4.tar.gz\n    url: https://pypi.python.org/packages/source/w/wera2netcdf/wera2netcdf-0.0.4.tar.gz\n    md5: e0e34c8477c849d0aea9b64b04ff1395\n\nbuild:\n    number: 0\n    script: python setup.py install --single-version-externally-managed --record record.txt\n\nrequirements:\n    build:\n        - python\n        - setuptools\n    run:\n        - python\n        - pandas\n        - netcdf4\n        - pygc\n        - pytz\n        - python-dateutil\n\ntest:\n  imports:\n    - wera2netcdf\n    - wera2netcdf.tests\n  requires:\n    - pytest\n\nabout:\n  home: https://github.com/axiom-data-science/wera2netcdf\n  license: MIT License\n  summary: A utility to convert WERA total ASCII files into CF NetCDF files.\n\nextra:\n    recipe-maintainers:\n        - kwilcox\n        - ocefpaf\n",
 "rendered_recipe": {
  "about": {
   "home": "https://github.com/axiom-data-science/wera2netcdf",
   "license": "MIT License",
   "summary": "A utility to convert WERA total ASCII files into CF NetCDF files."
  },
  "build": {
   "number": 0,
   "script": "python setup.py install --single-version-externally-managed --record record.txt"
  },
  "extra": {
   "recipe-maintainers": [
    "kwilcox",
    "ocefpaf"
   ]
  },
  "package": {
   "name": "wera2netcdf",
   "version": "0.0.4"
  },
  "requirements": {
   "build": [
    "python",
    "setuptools"
   ],
   "run": [
    "python",
    "pandas",
    "netcdf4",
    "pygc",
    "pytz",
    "python-dateutil"
   ]
  },
  "source": {
   "fn": "wera2netcdf-0.0.4.tar.gz",
   "md5": "e0e34c8477c849d0aea9b64b04ff1395",
   "url": "https://pypi.python.org/packages/source/w/wera2netcdf/wera2netcdf-0.0.4.tar.gz"
  },
  "test": {
   "imports": [
    "wera2netcdf",
    "wera2netcdf.tests"
   ],
   "requires": [
    "pytest"
   ]
  }
 },
 "version": "0.0.4"
}