{
 "about": {
  "home": "http://pyomo.org",
  "license": "BSD 3-clause",
  "summary": "Extra Python packages that enhance the functionality of Pyomo"
 },
 "conda_build_config": {},
 "files": [],
 "index": {
  "arch": "x86_64",
  "build": "py27_0",
  "build_number": 0,
  "depends": [
   "ipython",
   "matplotlib",
   "networkx",
   "numpy",
   "openpyxl",
   "pandas",
   "pymysql",
   "pyodbc",
   "pyro4",
   "python 2.7*",
   "pyyaml",
   "sympy",
   "xlrd"
  ],
  "license": "BSD 3-clause",
  "name": "pyomo.extras",
  "platform": "linux",
  "subdir": "linux-64",
  "version": "3.2"
 },
 "metadata_version": 1,
 "name": "pyomo.extras",
 "raw_recipe": "# Do metapackages have a version?\n# Do metapackages have a license?\n\npackage:\n  name: pyomo.extras\n  version: 3.2\n\nbuild:\n  number: 0\n\nrequirements:\n  build:\n    - python\n  run:\n    - python\n    - numpy\n    - ipython\n    - openpyxl\n    - sympy\n    - pymysql\n    - pyodbc\n    - pyro4\n    - pyyaml\n    - networkx\n    - xlrd\n    - pandas\n    - matplotlib\n\ntest:\n  imports:\n    - numpy\n    - IPython\n    - openpyxl\n    - sympy\n    - pymysql\n    - pyodbc\n    - Pyro4\n    - yaml\n    - networkx\n    - xlrd\n    - pandas\n    - matplotlib\n\nabout:\n  home: http://pyomo.org\n  license: BSD 3-clause\n  summary: 'Extra Python packages that enhance the functionality of Pyomo'\n\nextra:\n  recipe-maintainers:\n    - whart222\n    - Juanlu001\n    - jsiirola\n",
 "rendered_recipe": {
  "about": {
   "home": "http://pyomo.org",
   "license": "BSD 3-clause",
   "summary": "Extra Python packages that enhance the functionality of Pyomo"
  },
  "build": {
   "number": 0
  },
  "extra": {
   "recipe-maintainers": [
    "whart222",
    "Juanlu001",
    "jsiirola"
   ]
  },
  "package": {
   "name": "pyomo.extras",
   "version": 3.2
  },
  "requirements": {
   "build": [
    "python"
   ],
   "run": [
    "python",
    "numpy",
    "ipython",
    "openpyxl",
    "sympy",
    "pymysql",
    "pyodbc",
    "pyro4",
    "pyyaml",
    "networkx",
    "xlrd",
    "pandas",
    "matplotlib"
   ]
  },
  "test": {
   "imports": [
    "numpy",
    "IPython",
    "openpyxl",
    "sympy",
    "pymysql",
    "pyodbc",
    "Pyro4",
    "yaml",
    "networkx",
    "xlrd",
    "pandas",
    "matplotlib"
   ]
  }
 },
 "version": "3.2"
}