{
 "about": {},
 "conda_build_config": {},
 "files": [
  "lib/python2.7/site-packages/pyncml-0.0.8-py2.7.egg-info/PKG-INFO",
  "lib/python2.7/site-packages/pyncml/__init__.py",
  "lib/python2.7/site-packages/pyncml/pyncml.py",
  "lib/python2.7/site-packages/pyncml/test_pyncml.py"
 ],
 "index": {
  "arch": "x86_64",
  "build": "py27_0",
  "build_number": 0,
  "depends": [
   "netcdf4",
   "numpy",
   "python 2.7*",
   "pytz"
  ],
  "license": "MIT License",
  "name": "pyncml",
  "platform": "linux",
  "subdir": "linux-64",
  "version": "0.0.8"
 },
 "metadata_version": 1,
 "name": "pyncml",
 "raw_recipe": "package:\n    name: pyncml\n    version: 0.0.8\n\nsource:\n    fn: pyncml-0.0.8.tar.gz\n    url: https://pypi.python.org/packages/source/p/pyncml/pyncml-0.0.8.tar.gz\n    md5: 4a77f97a687561fde285f7fad1c297e2\n\nbuild:\n    number: 0\n    script: python setup.py install --single-version-externally-managed --record record.txt\n\nrequirements:\n    build:\n        - python\n        - setuptools\n        - netcdf4\n        - pytz\n    run:\n        - python\n        - numpy\n        - netcdf4\n        - pytz\n\ntest:\n    imports:\n        - pyncml\n\nabout:\n    home: https://github.com/axiom-data-science/pyncml\n    license: MIT License\n    summary: A simple python library to apply NcML logic to NetCDF files\n\nextra:\n    recipe-maintainers:\n        - kwilcox\n        - ocefpaf\n",
 "rendered_recipe": {
  "about": {
   "home": "https://github.com/axiom-data-science/pyncml",
   "license": "MIT License",
   "summary": "A simple python library to apply NcML logic to NetCDF files"
  },
  "build": {
   "number": 0,
   "script": "python setup.py install --single-version-externally-managed --record record.txt"
  },
  "extra": {
   "recipe-maintainers": [
    "kwilcox",
    "ocefpaf"
   ]
  },
  "package": {
   "name": "pyncml",
   "version": "0.0.8"
  },
  "requirements": {
   "build": [
    "python",
    "setuptools",
    "netcdf4",
    "pytz"
   ],
   "run": [
    "python",
    "numpy",
    "netcdf4",
    "pytz"
   ]
  },
  "source": {
   "fn": "pyncml-0.0.8.tar.gz",
   "md5": "4a77f97a687561fde285f7fad1c297e2",
   "url": "https://pypi.python.org/packages/source/p/pyncml/pyncml-0.0.8.tar.gz"
  },
  "test": {
   "imports": [
    "pyncml"
   ]
  }
 },
 "version": "0.0.8"
}