{
 "about": {},
 "conda_build_config": {},
 "files": [
  "Library/bin/charset.dll",
  "Library/bin/iconv.dll",
  "Library/include/iconv.h",
  "Library/include/libcharset.h",
  "Library/include/localcharset.h",
  "Library/lib/charset.lib",
  "Library/lib/iconv.lib"
 ],
 "index": {
  "arch": "x86_64",
  "build": "vc14_2",
  "build_number": 2,
  "depends": [],
  "features": "vc14",
  "license": "GPL and LGPL",
  "name": "libiconv",
  "platform": "win",
  "subdir": "win-64",
  "version": "1.14"
 },
 "metadata_version": 1,
 "name": "libiconv",
 "raw_recipe": "package:\n    name: libiconv\n    version: 1.14\n\nsource:\n    fn: libiconv-1.14.tar.gz\n    url: http://ftp.gnu.org/pub/gnu/libiconv/libiconv-1.14.tar.gz\n    md5: e34509b1623cec449dfeb73d7ce9c6c6\n    patches:\n        - patch1.patch  # [linux]\n        - CMakeLists.txt.patch  # [win]\n        - config.h.patch  # [win]\n        - configure.cmake.patch  # [win]\n\nbuild:\n    number: 2\n    features:\n        - vc9  # [win and py27]\n        - vc10  # [win and py34]\n        - vc14  # [win and py35]    \n\nrequirements:\n    build:\n        - python  # [win]\n        - cmake  # [win]\n\ntest:\n    commands:\n        - iconv --help  # [not win]\n        - conda inspect linkages -n _test libiconv  # [linux]\n\nabout:\n    home: https://www.gnu.org/software/libiconv/\n    license: GPL and LGPL\n    summary: Provides iconv for systems which don't have one (or that cannot convert from/to Unicode.)\n\nextra:\n    recipe-maintainers:\n        - ocefpaf\n        - jakirkham\n        - jhamman\n",
 "rendered_recipe": {
  "about": {
   "home": "https://www.gnu.org/software/libiconv/",
   "license": "GPL and LGPL",
   "summary": "Provides iconv for systems which don't have one (or that cannot convert from/to Unicode.)"
  },
  "build": {
   "features": [
    "vc14"
   ],
   "number": "2"
  },
  "extra": {
   "recipe-maintainers": [
    "ocefpaf",
    "jakirkham",
    "jhamman"
   ]
  },
  "package": {
   "name": "libiconv",
   "version": "1.14"
  },
  "requirements": {
   "build": [
    "python",
    "cmake"
   ]
  },
  "source": {
   "fn": "libiconv-1.14.tar.gz",
   "md5": "e34509b1623cec449dfeb73d7ce9c6c6",
   "patches": [
    "CMakeLists.txt.patch",
    "config.h.patch",
    "configure.cmake.patch"
   ],
   "url": "http://ftp.gnu.org/pub/gnu/libiconv/libiconv-1.14.tar.gz"
  },
  "test": {
   "commands": ""
  }
 },
 "version": "1.14"
}